,id,url,kind,title,date,origin,content
425,26308457,http://jhsjk.people.cn/article/26308457,活动,全国政协举行新年茶话会 习近平发表重要讲话,42004,新华网,"

全国政协举行新年茶话会 习近平发表重要讲话

来源：新华网        ??发布时间：2014-12-31




2014年12月31日，中国人民政治协商会议全国委员会在北京全国政协礼堂举行新年茶话会。中共中央政治局常委、全国政协主席俞正声主持茶话会。新华社记者庞兴雷摄

全国政协举行新年茶话会

习近平发表重要讲话

李克强张德江刘云山王岐山张高丽出席

俞正声主持

中国人民政治协商会议全国委员会12月31日上午在全国政协礼堂举行新年茶话会。党和国家领导人习近平、李克强、张德江、俞正声、刘云山、王岐山、张高丽等同各民主党派中央、全国工商联负责人和无党派人士代表、中央和国家机关有关方面负责人以及首都各族各界人士代表欢聚一堂，共迎2015年元旦。

中共中央总书记、国家主席、中央军委主席习近平在茶话会上发表重要讲话。他强调，问题是时代的声音，人心是最大的政治。推进党和国家各项工作，必须坚持问题导向，倾听人民呼声。我们的目标越伟大，我们的使命越艰巨，就越需要所有人拧成一股绳去干事创业。让我们更加紧密地团结起来，向着我们共同的奋斗目标、向着更加辉煌的明天奋勇前进。

习近平代表中共中央、国务院和中央军委，向各民主党派、工商联和无党派人士、各人民团体，向全国广大工人、农民、知识分子、干部和各界人士，向人民解放军指战员、武警官兵和公安干警，向香港特别行政区同胞、澳门特别行政区同胞、台湾同胞和海外侨胞，向关心和支持中国现代化建设的国际友人，致以节日的祝福，祝大家新年好。

习近平指出，在过去的一年里，中共中央团结带领全国各族人民，坚持稳中求进工作总基调，积极适应经济发展新常态，注重谋划全局性、战略性、长远性的重大问题，推动社会主义经济建设、政治建设、文化建设、社会建设、生态文明建设以及国防和军队建设、外交工作取得重大进展。中共中央重点抓了党的群众路线教育实践活动，聚焦惩治形式主义、官僚主义、享乐主义和奢靡之风，党风政风为之一新。我们加大反腐败斗争力度，坚持“老虎”、“苍蝇”一起打，一批腐败分子被绳之以党纪国法。一年来，我们蹄疾步稳地推进各项改革，中央全面深化改革领导小组确定的80个重点改革任务基本完成，此外中央有关部门还完成了108个改革任务，各方面共出台370条改革成果，一些多年来难啃的硬骨头啃下来了，改革为我国发展注入了强大动力。这些成绩，是大家共同创造的，光荣属于大家。

习近平强调，当前，时和势总体有利，但艰和险在增多。我们要全面贯彻落实中共十八大和十八届三中、四中全会精神，以邓小平理论、“三个代表”重要思想、科学发展观为指导，继续推进全面建成小康社会、全面深化改革、全面依法治国、全面从严治党，突出创新驱动，强化风险防控，加强民生保障，如期完成“十二五”规划确定的各项目标任务。我们要坚定不移维护香港、澳门长期繁荣稳定。我们要深化两岸合作交流，促进两岸一家亲、共筑中国梦。我们要高举和平、发展、合作、共赢旗帜，积极实施“一带一路”战略，促进人类文明进步事业。

习近平指出，中共十八届四中全会对全面推进依法治国作出顶层设计和总体部署。全面推进依法治国是国家治理领域一场广泛而深刻的革命。我们要逐条逐项落实全面推进依法治国各项部署和措施。

习近平强调，在即将过去的一年里，我们隆重庆祝了中国人民政治协商会议成立65周年，人民政协发挥作为协商民主重要渠道作用，着力搭建协商平台、创新协商载体、增加协商密度，聚焦改革发展稳定重大问题深入调查研究、反映社情民意、开展民主监督，为推进改革开放和社会主义现代化建设作出了重要贡献。新的一年，我们要巩固和发展最广泛的爱国统一战线，坚持和完善中国共产党领导的多党合作和政治协商制度，不断为事业发展凝聚人心、增添力量。人民政协要深入进行调研视察、协商议政，积极开展民主监督，讲真话、进诤言，出实招、谋良策。要加强协商民主制度建设，为各党派团体和各族各界人士搭建协商平台、丰富协商形式、创造民主氛围，为我国社会主义民主政治发展注入新的活力。（讲话全文另发）

茶话会由中共中央政治局常委、全国政协主席俞正声主持。他指出，习近平总书记的重要讲话回顾2014年中共中央团结带领全国各族人民奋力推进改革开放和社会主义现代化建设取得的重要成就，分析当前我们面临的形势和任务，强调做好2015年党和国家各项工作必须坚持的重要原则，对于我们深入贯彻落实中共十八大和十八届三中、四中全会精神，主动适应新常态，奋力开创新局面，协调推进全面建成小康社会、全面深化改革、全面推进依法治国、全面从严治党进程，具有重要指导意义。讲话充分肯定一年来人民政协围绕中心、服务大局，认真履行职能取得的新成绩，结合新形势新任务，对进一步发挥统一战线重要作用、做好人民政协各项工作提出明确要求。我们一定要认真学习领会、深入贯彻落实，切实把思想和行动统一到中共中央决策部署上来，积极开展调查研究，扎实推进协商民主，广泛汇聚各方力量，不断提升履职能力，努力为党和国家事业发展作出新贡献。

民盟中央主席张宝文代表各民主党派中央、全国工商联和无党派人士讲话，表示将更加紧密地团结在以习近平同志为总书记的中共中央周围，继承和发扬多党合作的优良传统，凝心聚力，锐意进取，共同开创中国特色社会主义事业新局面，为全面建成小康社会、实现“两个一百年”奋斗目标和中华民族伟大复兴的中国梦而努力奋斗。

茶话会上，习近平等来到各界人士中间，亲切地同大家握手交谈，互致问候。随后，部分全国政协委员和文艺工作者表演了精彩节目，会场洋溢着喜庆祥和的热烈气氛。

在京中共中央政治局委员、中央书记处书记，全国人大常委会、国务院部分领导同志，全国政协领导同志和曾任全国政协副主席的在京老同志出席茶话会。（新华网北京12月31日电 记者吴晶晶、孙铁翔）


(责编：程宏毅                     )"
426,26304181,http://jhsjk.people.cn/article/26304181,活动,新年戏曲晚会举行 习近平李克强张德江俞正声刘云山王岐山张高丽出席观看,42004,人民网－人民日报,"
 
新年戏曲晚会举行 习近平李克强张德江俞正声刘云山王岐山张高丽出席观看

来源：人民网－人民日报        ??发布时间：2014-12-31


2015年新年戏曲晚会30日晚在国家大剧院举行。党和国家领导人习近平、李克强、张德江、俞正声、刘云山、王岐山、张高丽等，与首都近千名群众一起观看演出，喜迎新年。

夜幕下的国家大剧院流光溢彩、火树银花。戏剧场内笑语盈盈，暖意融融，洋溢着浓郁的节日气氛。19时45分，习近平等党和国家领导人来到晚会现场，同前来观看演出的老艺术家们一一握手，全场响起热烈的掌声。

今年的戏曲晚会，不同剧种异彩纷呈，传统和新编剧目各具特色，展现出中华戏曲艺术的源远流长和博大精深，将广大戏曲工作者贯彻文艺工作座谈会精神，传承和弘扬中华优秀传统文化的最新成果奉献给了观众。

一部百花争艳的《梨园曲》拉开晚会帷幕。河北梆子《大登殿》、徽剧《小宴》、昆曲《单刀会》等经典唱段展示了传统剧目的无穷魅力。闽剧《丹青魂》、越剧《追鱼》、吉剧《包公赔情》等新编历史剧，将传统与时代相结合，焕发出戏曲艺术的勃勃生机。新编京剧《钦差林则徐》和《安国夫人》一文一武两段表演，技艺精湛、韵味十足。汉剧《红色娘子军》、湘剧《李贞还乡》、眉户戏《迟开的玫瑰》、豫剧《焦裕禄》用古老剧种演绎现代题材，展现优秀党员干部、模范人物崇高的精神境界，更是感人至深。新编京剧、晋剧《廉吏于成龙》表达出自古以来人们对为官者清正廉洁的崇敬。“东方睡狮已醒，中国大船扬帆。华夏儿女同心逐梦，破浪向前……”晚会在京剧歌曲《唱响中国梦》的激昂旋律中结束。整场演出高潮迭起，给观众带来了真善美的艺术享受。

在京中共中央政治局委员、中央书记处书记、全国人大常委会部分领导同志、国务委员、全国政协部分领导同志，有关部门负责同志等观看了演出。（新华社北京12月30日电 记者隋笑飞）

《 人民日报 》（ 2014年12月31日 01 版）


(责编：常雪梅                     )"
427,26304182,http://jhsjk.people.cn/article/26304182,活动,习近平：巩固良好势头再接再厉乘势而上 推动全面深化改革不断取得新成效,42004,人民网－人民日报,"

习近平：巩固良好势头再接再厉乘势而上 推动全面深化改革不断取得新成效
李克强刘云山张高丽出席
来源：人民网－人民日报        ??发布时间：2014-12-31


中共中央总书记、国家主席、中央军委主席、中央全面深化改革领导小组组长习近平12月30日上午主持召开中央全面深化改革领导小组第八次会议并发表重要讲话。他强调，今年是全面深化改革的开局之年，改革形成了上下联动、主动作为、蹄疾步稳、狠抓落实的好局面，呈现出全面播种、次第开花的生动景象，在一些重要领域和关键环节取得重大进展和积极成效，有力促进了稳增长、调结构、惠民生、防风险等方面的工作。明年是全面深化改革的关键之年，气可鼓而不可泄，要巩固改革良好势头，再接再厉、趁热打铁、乘势而上，推动全面深化改革不断取得新成效。

中共中央政治局常委、中央全面深化改革领导小组副组长李克强、刘云山、张高丽出席会议。

会议审议通过了《关于2014年全面深化改革工作的总结报告》、《中央全面深化改革领导小组2015年工作要点》、《贯彻实施党的十八届四中全会决定重要举措2015年工作要点》。

会议强调，今年以来，在党中央坚强领导下，各地区各部门把落实党的十八届三中全会提出的各项改革举措作为中心任务，凝心聚力，统筹谋划，把抓部署、抓统筹、抓方案、抓落实、抓督办、抓宣传等关键环节衔接贯通，一个问题一个问题跟进解决，一个节点一个节点扎实推进，一个方案一个方案有序推出，经济体制改革领先推进，民主法制领域改革协调推进，文化体制改革积极创新，社会治理体制改革标本兼治，社会事业领域改革统筹推进，生态文明体制改革稳慎探路，党的纪律检查体制改革立行立改，党的建设制度改革力度加大。

会议指出，2014年领导小组确定的80个重点改革任务基本完成，此外中央有关部门还完成了108个改革任务，共出台370条改革成果。这些改革，有的是具有顶层设计性质的专项改革总体方案，带有统领和指导作用，有的是涉及多部门、跨不同领域，牵一发动全身的突破口，有的是议论多年、改革阻力较大、多年都啃不动的硬骨头，还有的是具有积极探路性质的改革试点，各地区也结合实际推出一批有力度、有特色、有影响的改革举措。实践说明，中央全面深化改革领导小组的组织领导是坚强有力的，推进改革的决策机制、统筹协调机制、督办督察机制、宣传引导机制也是有效管用的。这些机制要继续坚持和发挥作用。

会议指出，明年是全面深化改革的关键之年，气可鼓而不可泄。各地区各部门都要认真回顾开局之年的工作，总结经验、找出不足、摸索规律，为今后改革工作创造良好条件。要强化责任意识、问题意识、攻坚意识，加强组织领导。要抓好改革任务统筹协调，更加注重改革的系统性、整体性、协同性，重点提出一些起标志性、关联性作用的改革举措，把需要攻坚克难的硬骨头找出来，把需要闯的难关、需要的险滩标出来，加强对跨区域跨部门重大改革事项协调，一鼓作气、势如破竹地把改革难点攻克下来。

会议强调，要把提高改革质量放到重要位置，坚持速度服从质量，做实做细调查研究，多深入基层听取各方意见，严格方案制定程序。对已出台的具有重大结构支撑作用的改革，要抓紧出台细化实施方案，坚决消除“中梗阻”、“肠梗阻”。对已经出台的重大方案要排队督察，及时跟踪、及时检查、及时评估、及时整改，重在发现问题。

会议指出，要明确各部门各单位落实改革方案的责任和要求，提高改革方案穿透力，以钉钉子精神抓好落实。要增强改革动力和合力，强化部门的责任担当，增强大局意识、紧迫意识，以政府自身改革带动重要领域改革。要发动群众参与改革，引导社会支持改革，引导社会舆论和各方预期，汇聚起全社会支持改革的正能量。

会议强调，中央全面深化改革领导小组要对十八届三中、四中全会重要改革举措进行一体部署、一体落实、一体督办，切实抓好政策统筹、方案统筹、力量统筹、进度统筹。有关单位要抓紧分解任务，明确完成时间，确保改革有序推进、扎实落地。

会议审议通过了《关于进一步规范刑事诉讼涉案财物处置工作的意见》。会议指出，规范刑事诉讼涉案财物处置工作，是一件事关正确惩治犯罪、保障人权的大事，是一项促进司法公正、提高司法公信力的重要举措。这些年来，司法不公、贪赃枉法的一个突出问题就发生在刑事诉讼涉案财物处置的过程中。涉案财物处置涉及不同诉讼领域、不同执法司法环节，是一项跨部门、跨地方的复杂工作，政策性、操作性要求都很高，各地区各部门要牢固树立大局意识，加强协作配合，尽快探索建立涉案财物集中管理信息平台，完善涉案财物处置信息公开机制。各级党政部门要率先尊法守法，不得干预涉案财物处置过程。要加强境外追赃追逃工作，抓紧健全境外追赃追逃工作体制机制，运用法治思维和法治方式开展追赃追逃工作。有关部门要对涉案财物的定义、认定标准和范围等进行明确，增强各地和各司法机关执行政策的统一性。

会议还就构建开放型经济新体制、全面深化公安改革等问题进行了研究。

中央全面深化改革领导小组成员出席，中央和国家有关部门负责同志列席会议。（新华社北京12月30日电）

《 人民日报 》（ 2014年12月31日 01 版）


(责编：常雪梅                     )"
428,26244937,http://jhsjk.people.cn/article/26244937,活动,习近平:推进“一国两制”实践的信心和决心绝不会动摇,41993,新华网,"

习近平:推进“一国两制”实践的信心和决心绝不会动摇

来源：新华网        ??发布时间：2014-12-20


庆祝澳门回归祖国１５周年大会暨澳门特别行政区第四届政府就职典礼隆重举行　

习近平出席并发表重要讲话

庆祝澳门回归祖国１５周年大会暨澳门特别行政区第四届政府就职典礼２０日上午在澳门东亚运动会体育馆隆重举行。中共中央总书记、国家主席、中央军委主席习近平出席并发表重要讲话。他强调，在中央政府、澳门特别行政区政府和社会各界人士共同努力下，在全国各族人民大力支持下，“一国两制”在澳门的实践必将谱写出新的精彩篇章，澳门这朵祖国的美丽莲花必将绽放出更加绚丽、更加迷人的色彩。

会场内悬挂着中华人民共和国国旗和澳门特别行政区区旗，气氛隆重热烈。当习近平和夫人彭丽媛在澳门特别行政区行政长官崔世安和夫人霍慧芬陪同下步入会场时，全场起立鼓掌。

上午９时３０分，庆祝大会暨就职典礼在雄壮的国歌声中开始。

习近平走上主席台监誓。崔世安首先宣誓就职，他面对国旗和澳门特别行政区区旗，举起右手，按照澳门特别行政区基本法规定的誓词庄严宣誓。宣誓完毕，习近平同崔世安紧紧握手。

接着，由习近平监誓，澳门特别行政区第四届政府主要官员在崔世安带领下宣誓就职。宣誓完毕后，习近平同他们一一握手致意。

随后，由崔世安监誓，澳门特别行政区行政会委员宣誓就职。

在热烈的掌声中，习近平发表了重要讲话。他首先代表中央政府和全国各族人民，向全体澳门居民致以诚挚的问候，向新就任的澳门特别行政区第四任行政长官崔世安和第四届政府主要官员、行政会委员表示热烈的祝贺。向所有关心澳门、为澳门繁荣稳定作出贡献的海内外同胞和国际友人表示衷心的感谢。

习近平指出，澳门回归祖国１５年来，“一国两制”实践取得了丰硕成果。“一国两制”、“澳人治澳”、高度自治方针和澳门特别行政区基本法在澳门社会广泛深入人心、得到切实贯彻落实，宪法和基本法规定的澳门特别行政区宪制秩序得到尊重和维护，中央全面管治权有效行使，特别行政区享有的高度自治权受到充分保障。同时，澳门同祖国内地的交流合作日益密切，继续为国家改革开放和现代化建设作出独特贡献，分享祖国发展带来的机遇和成果。澳门同胞对国家的认同感和向心力不断加强，血浓于水的民族感情不断升华。作为中西文化荟萃的历史文化名城，澳门展示了活力四射的形象。

习近平强调，在新的历史起点上，要把澳门经济社会发展的良好局面巩固好，发展好，必须再接再厉、开拓进取，为澳门长期繁荣稳定打下更为坚实的基础。他提出４点希望。第一，继续奋发有为，不断提高特别行政区依法治理能力和水平。要善于运用法治思维和法治方式进行治理，特别是要完善与澳门特别行政区基本法实施相配套的制度和法律体系，夯实依法治澳的制度基础，努力打造勤政、廉洁、高效、公正的法治政府，加强公职人员队伍建设和管理，在全社会弘扬法治精神，共同维护法治秩序。第二，继续统筹谋划，积极推动澳门走经济适度多元可持续发展道路。这是关系澳门居民利益的大事，也是关系区域发展乃至国家发展的大事。要做好顶层设计，制定具体推进的步骤和措施，坚持提升自身发展素质能力和加强区域合作“两条腿”走路，拓宽澳门发展空间，努力实现与内地共同发展、共同进步。第三，继续筑牢根基，努力促进社会和谐稳定。要坚持以人为本的施政理念，察民情、知民需、解民忧、纾民困，妥善处理社会多元诉求，平衡好各方利益，积极营造更加公平公正的社会环境，让广大居民更好分享发展成果。第四，继续面向未来，加强青少年教育培养。澳门青少年是澳门的希望，也是国家的希望，关系到澳门和祖国的未来。要实现爱国爱澳光荣传统代代相传，保证“一国两制”事业后继有人，就要加强对青少年的教育培养。要高度重视和关心爱护青年一代，为他们成长、成才、成功创造良好条件。

习近平指出，“一国两制”是国家的一项基本国策。牢牢坚持这项基本国策，是实现香港、澳门长期繁荣稳定的必然要求，也是实现中华民族伟大复兴中国梦的重要组成部分，符合国家和民族根本利益，符合香港、澳门整体和长远利益，符合外来投资者利益。

习近平强调，继续推进“一国两制”事业，必须牢牢把握“一国两制”的根本宗旨，共同维护国家主权、安全、发展利益，保持香港、澳门长期繁荣稳定；必须坚持依法治港、依法治澳，依法保障“一国两制”实践；必须把坚持一国原则和尊重两制差异、维护中央权力和保障特别行政区高度自治权、发挥祖国内地坚强后盾作用和提高港澳自身竞争力有机结合起来，任何时候都不能偏废。继续推进“一国两制”事业，是中央政府、特别行政区政府和包括港澳同胞在内的全国各族人民的共同使命，无论遇到什么样的困难和挑战，我们对“一国两制”方针的信心和决心都绝不会动摇，我们推进“一国两制”实践的信心和决心都绝不会动摇。

崔世安在致辞中说，我们感恩于中央政府的支持和信任，感恩于澳门居民的关爱和培育，我们定当牢记誓言，坚守信念，不辱使命，不负重托。当尽全力推进“一国两制”、“澳人治澳”、高度自治的伟大事业，全面、完整、正确理解和贯彻基本法，坚定不移维护国家的主权、安全、发展利益，全力维护澳门特区长期繁荣稳定。我们坚信，有中央政府强而有力的支持，有澳门居民同舟共济，我们定能携手奋进，共圆中华民族伟大复兴的中国梦，开创澳门明天更美好的未来。

王沪宁、范长龙、栗战书、王晨、杨洁篪、张庆黎等出席庆祝大会暨就职典礼。

全国政协副主席何厚铧、香港特别行政区行政长官梁振英，以及澳门各界代表和特邀嘉宾也出席庆祝大会暨就职典礼。

就职典礼结束后，习近平会见了澳门特别行政区政府新任主要官员以及立法、司法机关负责人。

习近平指出，社会各界对大家有较高期待，你们就职后，要尽快熟悉工作，保证各方面工作顺利交接、平稳推进。要增强大局观念和团队意识，严格按照基本法办事，自觉维护行政长官权威，确保行政、立法、司法机关顺畅运作。要从市民最关心的问题入手，抓几件实事，力争取得实效。面对特区发展遇到的问题和可能出现的挑战，要勇于担当、敢于碰硬，既要善于早作谋划，提前化解风险，又要持之以恒、久久为功。

习近平表示，相信在中央政府大力支持下，在崔世安行政长官坚强带领下，大家一定能够励精图治、继往开来，同澳门各界人士一道，携手开创澳门繁荣稳定的新局面。

王沪宁、范长龙、栗战书、王晨、杨洁篪、张庆黎等参加会见。

澳门特别行政区行政长官崔世安也参加会见。(新华网澳门１２月２０日电 记者霍小光 赵卫 牛琪）












(责编：景h                        )"
